,submarca,descricao_completa,descricao_ajustada,de_para
33,BRAHMA MALZIBIER,"Para quem procura uma cerveja escura e encorpada com sabor diferenciado, Brahma Malzbier é ideal, pois tem um sabor levemente adocicado e aroma de caramelo. Além disso, é muito nutritiva, por ser rica em carboidratos. Brahma lançou a primeira cerveja tipo Malzbier no mercado.. As notas de malte torrados deixam essa cerveja excelente para harmonizar com sobremesas, como torta de chocolate e sorvete de creme.. água, malte, milho, açúcar de cana, lúpulo, corante caramelo iii ins 150c. . 8-12 ºC. 8.5",procurar cervejar escuro encorpar sabor diferenciar Brahma Malzbier ideal sabor levemente adocicar aromar caramelo nutritivo rico carboidratos Brahma lançar cervejar Malzbier mercar noto maltar torrar deixar cervejar excelente harmonizar sobremesa torto chocolate sorvete cremar água maltar milho açúcar cano lúpulo corante caramelo iii ins 150c 8-12 ºC. 8.5,
34,BRAHMA REFRESH,"Uma cerveja mais leve, ideal para locais de clima quente, a Brahma Refresh veio depois de um ano e meio de pesquisas em inovação. O resultado é um líquido com um gosto mais suave e refrescante. Por isso, a Brahma Refresh foi desenvolvida especialmente para os mercados do Norte e Nordeste do Brasil.. . água, malte, milho, lúpulo. . . ",cervejar levar ideal locar clima quentar Brahma Refresh vir ano pesquisar inovação resultar líquido gostar suave refrescante Brahma Refresh desenvolvido especialmente mercar Norte Nordeste Brasil água maltar milho lúpulo,
35,BRAHMA ZERO,"O mesmo sabor da Brahma, completamente sem álcool. Brahma 0,0 tem sabor predominante de malte e notas frutadas e de lúpulo. É leve, com sabor clássico de cervejas de baixa fermentação. De cor amarelo dourada, tem baixo amargor, aftertaste baixo e uma espuma cremosa consistente. A sensação é de estar bebendo uma cerveja com álcool.. Por ser uma cerveja leve e bem carbonatada, combina com queijos pouco condimentados, saladas, frutos do mar e petiscos fritos.. água, malte, milho, açúcar de cana, lúpulo. . 0-4 ºC. 8.5","sabor Brahma completamente álcool Brahma 0,0 sabor predominante maltar noto frutar lúpulo levar sabor clássico cervejar baixo fermentação cor amarelar dourar amargor aftertaste espumar cremoso consistente sensação beber cervejar álcool cervejar levar carbonatar combinar queijo condimentar salada fruto mar petisco frito água maltar milho açúcar cano lúpulo 0-4 ºC. 8.5",
36,CERVEJARIA COLORADOCOLORADO APPIA,"A palavra Appia vem do latim e significa mel. O nome perfeito para a primeira cerveja do Brasil a utilizar mel em sua fórmula. Uma combinação exótica que, além do mel das flores das laranjeiras, é feita a partir dos melhores maltes de cevada e trigo, além de nossa exclusiva levedura de alta fermentação. Doce, encorpada e refrescante, é perfeita para quem busca novos e diferentes sabores.. “Por ser uma cerveja leve, a Colorado Appia vai combinar muito bem comidas mais leves como pernil, saladas, frango, massas e queijo brie.. cerveja, água, mel, leveduras. . 4-8 ºC. 10.0",palavra Appia latim significar mel nome perfazer cervejar Brasil utilizar mel fórmula combinação exótico mel florir laranjeira feito melhorar malte cevar trigar exclusivo levedura alto fermentação Doce encorpar refrescante perfeito buscar diferente sabor cervejar levar Colorado Appia combinar comido leve pernil salada frango massa queijar brie cervejar água mel levedura 4-8 ºC. 10.0,
37,CERVEJARIA COLORADOCOLORADO BERTHO,"A Cerveja Colorado Berthô é uma American Brown Ale feita com Bertholletia Excelsa. Mas pode chamá-la simplesmente de Berthô, a cerveja que foi buscar na culinária mais diversificada do Brasil o seu ingrediente especial: a castanha-do-Pará. O tom adocicado do malte, combinado com o amargor dos lúpulos especiais e da castanha, criam um sabor único e inconfundível, assim como a cultura paraense.. . água, malte de cevada, aveia, açúcar mascavo, castanha do pará, lúpulo, fermento. . . ",Cerveja Colorado Berthô American Brown Ale feito Bertholletia Excelsa chamá-la simplesmente Berthô cervejar buscar culinário diversificar Brasil ingrediente especial castanha-do-Pará tom adocicar maltar combinar amargor lúpulo especial castanho criar sabor único inconfundível cultura paraense água maltar cevar aveia açúcar mascavar castanho parar lúpulo fermentar,
38,CERVEJARIA COLORADOCOLORADO CAUIM,"Seu nome Cauim vem do Tupi e se refere a uma antiga bebida fermentada de cereais e mandioca, fabricada pelos índios brasileiros. Não por acaso esta deliciosa cerveja combina fermento alemão, lúpulo tcheco, cevada maltada holandesa e, é claro, a brasileiríssima mandioca.. . água, malte, fécula de mandioca, lúpulo. . . ",nome Cauim Tupi referir antigo bebido fermentar cereal mandioca fabricar índio brasileiro acaso delicioso cervejar combinar fermentar alemão lúpulo tcheco cevar maltar holandês claro brasileiríssima mandioca água maltar fécula mandioca lúpulo,
39,CERVEJARIA COLORADOCOLORADO CAUIM 016,"Esta cerveja surgiu do amor pela terra natal da Cervejaria Colorado, Ribeirão Preto. É uma Pilsen produzida com mandioca, como a Cauim original, porém, mais leve e com Dry Hopping de lúpulos franceses. O resultado é maior refrescância e um aroma inconfundível.. . água, malte, fécula de mandioca, lúpulo. . . ",cervejar surgir amor terra natal Cervejaria Colorado Ribeirão Preto Pilsen produzir mandioca Cauim original levar Dry Hopping lúpulo francês resultar refrescância aromar inconfundível água maltar fécula mandioca lúpulo,
40,CERVEJARIA COLORADOCOLORADO DEMOISELLE,"Demoiselle, uma cerveja escura como a noite e que leva café na sua formulação. Esta cerveja Porter é feita com maltes importados da mais alta qualidade e o melhor café da região da Alta Mogiana. Este café é comprado direto do produtor, moído e torrado segundo nossas especificações e macerado em água fria para só então ser adicionado ao mosto cervejeiro. Usando este método evitamos que o café perca seus melhores aromas devido às altas temperaturas presentes no processo de brassagem.. . água, malte, açúcar, extrato natural de café, lúpulo. . . ",Demoiselle cervejar escuro noite levar café formulação cervejar Porter feito malte importar alto qualidade melhor café região Alta Mogiana café comprar direto produtor moer torrar especificação macerar água frio adicionar mosto cervejeiro Usando método evitar café perder melhorar aromar dever alto temperatura presente processar brassagem água maltar açúcar extrato natural café lúpulo,
41,CERVEJARIA COLORADOCOLORADO EUGENIA,"Eugênia é uma cerveja do estilo Session IPA, com aromas marcantes dos lúpulos americanos, alemães e franceses, com um ingrediente especial: a fruta Uvaia, típica da Mata Atlântica, rica em vitamina C e A, super aromática e com sabor cítrico. A Cerveja Colorado Eugênia é leve, refrescante e amarga na medida (40 IBU). Desiberne, cerveja pode ter fruta!. . água, malte, polpa de uvaia, lúpulo, levedura, fermento. . . ",Eugênia cervejar estilar Session IPA aromar marcante lúpulo americano alemão francês ingrediente especial frutar Uvaia típico Mata Atlântica rico vitaminar super aromático sabor cítrico Cerveja Colorado Eugênia levar refrescante amargo medir 40 IBU Desiberne cervejar frutar água maltar polpa uvaia lúpulo levedura fermentar,
42,CERVEJARIA COLORADOCOLORADO GUANABARA,"A Guanabara Wood Aged é diferente. Tão diferente, que fica até difícil explicar qual o sabor dela. Mas, vamos lá: ela é uma Imperial Russian Stout com rapadura queimada do Seu Zé e da Dona Maria. Tem 10,5% de álcool e é envelhecida em barril de Umburana. Tudo, claro, vindo da nossa querida terra: o Brasil. Esse encontro de ingredientes brasileiros com o barril deu origem a um sabor que já ganhou 21 prêmios ao redor do mundo. E ainda transformou a Guanabara na cerveja mais premiada da Colorado.. . água, malte, rapadura, lúpulo. . . ","Guanabara Wood Aged diferente diferente ficar difícil explicar sabor dela ir Imperial Russian Stout rapadura queimar Zé Dona Maria 10,5 álcool envelhecido barril Umburana claro querido terra Brasil encontrar ingrediente brasileiro barril dar origem sabor ganhar 21 prêmios redor mundo transformar Guanabara cervejar premiar Colorado água maltar rapadura lúpulo",
43,CERVEJARIA COLORADOCOLORADO INDICA,"A Indica Colorado traz a legítima fórmula utilizada pelos soldados ingleses em sua longa viagem marítima até a Índia. Detalhe: com um toque especial da rapadura. Não por acaso, foi eleita pela revista Prazeres da Mesa a Cerveja do Ano e ainda recebeu 3 estrelas na publicação inglesa Pocket Beer Guide, o mais respeitado guia de cervejas do mundo.. . água, malte, rapadura, lúpulo. . . ",Indica Colorado trazer legítimo fórmula utilizar soldar inglesar longo viagem marítimo Índia Detalhe tocar especial rapadura acaso eleito revisto Prazeres Mesa Cerveja Ano receber estrelo publicação inglesar Pocket Beer Guide respeitar guiar cervejar mundo água maltar rapadura lúpulo,
44,CERVEJARIA COLORADOCOLORADO ITHACA,"O nome da cerveja Colorado Ithaca vem de uma pequena ilha grega, terra natal de Ulisses da Odisséia. Uma cerveja que já nasceu de uma luta não poderia ter outro nome. Ainda mais uma Imperial Stout que não abre mão do seu jeitinho brasileiro. É por isso que sua fórmula conta com um elemento nordestino: a rapadura queimada. O resultado é uma cerveja porreta que, assim como a alegria do Nordeste, também tem vida longa. Ela harmoniza muito bem com carnes de caça, queijos duros bem maturados, presunto cru e sobremesas como creme brulè e pudim de leite. Possui medalha de Ouro em diversos festivais como: Mondial de La Bière (2013) e Festival Brasileiro da Cerveja (2013, 2014, 2015).. . água, malte de cevada, rapadura, lúpulo. . . ",nome cervejar Colorado Ithaca pequeno ilhar grego terra natal Ulisses Odisséia cervejar nascer lutar poder outro nome Imperial Stout abrir mão jeito brasileiro fórmula contar elemento nordestino rapadura queimar resultar cervejar porreta alegria Nordeste vidar longo harmonizar carne caçar queijo duro maturar presunto cru sobremesa cremar brulè pudim leite Possui medalhar Ouro diverso festival Mondial La Bière 2013 Festival Brasileiro Cerveja 2013 2014 2015 água maltar cevar rapadura lúpulo,
45,CERVEJARIA COLORADOCOLORADO MURICA,"Apaixonados pela miscigenação brasileira, casamos a maciez da Cream Ale (família Pale Ale) com o agridoce da Graviola, fruta que nasceu no Caribe e cresce no Brasil há mais de 500 anos. Tanto, que já tem até apelido: araticum, coração-de-rainha ou jaca-do-pará, mas o nome de batismo mesmo é Annona muricata. Assim nasceu a Cerveja Colorado Murica, mais um fruto de nossa intimidade com o Brasil.. . água, malte de cevada, suco de graviola, lúpulo, fermento. . . ",Apaixonados miscigenação brasileiro casar macieza Cream Ale família Pale Ale agridoce Graviola frutar nascer Caribe crescer Brasil haver 500 ano apelidar araticum coração-de-rainha jaca-do-pará nome batismo Annona muricata nascer Cerveja Colorado Murica frutar intimidade Brasil água maltar cevar suco graviola lúpulo fermentar,
46,CERVEJARIA COLORADOCOLORADO NASSAU,"A Cerveja Colorado Nassau é uma white IPA feita com adição de caju em conjunto com Dry hopping usando o lúpulo Equinox. Cerveja clara e não filtrada, sabor marcante com amargor presente na medida, tem aroma de frutas tropicais para destacar o aroma do caju. Harmoniza muito bem com frutos do mar, comidas apimentadas e queijos fortes.. . água, malte de cevada, malte de trigo, suco de caju, lúpulo. . . ",Cerveja Colorado Nassau white IPA feito adição caju conjuntar Dry hopping usar lúpulo Equinox Cerveja claro filtrar sabor marcante amargor presentar medir aromar frutar tropicar destacar aromar caju Harmoniza fruto mar comido apimentar queijo forte água maltar cevar maltar trigar suco caju lúpulo,
47,CERVEJARIA COLORADOCOLORADO RIBEIRAO,"Uma cerveja que o nome já diz tudo. Nascida em Ribeirão Preto, nossa casa, é uma lager leve e refrescante, mas com a cara de Colorado, uma cervejaria que nunca faria mais do mesmo: cerveja clara com laranja, com IBU 20 e 4,5% de teor alcoólico com toda qualidade da primeira cervejaria artesanal do Brasil por um preço muito mais acessível do que a maioria!. A citricidade e leveza da Ribeirão Lager harmonizam com alimentos leves e frescos como peixes grelhados e saladas. O amargor ajuda a quebrar a gordura do camarão alho e óleo.. água, malte de cevada, lúpulo, extrato de casca de laranja. . 0-4º C. 20.0","cervejar nome Nascida Ribeirão Preto casar lager levar refrescante caro Colorado cervejar fazer cervejar claro laranjo IBU 20 4,5 teor alcoólico qualidade cervejar artesanal Brasil preço acessível citricidade leveza Ribeirão Lager harmonizar alimento leve fresco peixe grelhar salada amargor ajudar quebrar gordura camarão alho óleo água maltar cevar lúpulo extrato cascar laranjo 0-4º C. 20.0",
48,CERVEJARIA COLORADOCOLORADO ROSALIA,"A Cerveja Colorado Rosália traz a brasilidade das frutas vermelhas (grumixama, amora do mato e cereja do rio grande), adicionadas ao hibisco, flor símbolo do Havaí. Seu sabor leve, ácido e adocicado casa perfeitamente com o herbal proveniente do hibisco, proporcionando um aroma frutado e uma experiência única.. . água, malte de cevada, extrato aromático de hibisco, suco de amora do mato, suco de cambuci, suco de cereja-do-rio-grande, suco de grumixama, lúpulo. . . ",Cerveja Colorado Rosália trazer brasilidade frutar vermelho grumixama amora matar cereja rir adicionar hibisco flor símbolo Havaí sabor levar ácido adocicar casar perfeitamente herbal proveniente hibisco proporcionar aromar frutar experiência único água maltar cevar extrato aromático hibisco suco amora matar suco cambuci suco cereja-do-rio-grande suco grumixama lúpulo,
49,CERVEJARIA COLORADOCOLORADO VIXNU,"Vixnu, além de ser o nome de uma das principias divindades hindus, é também o nome desta deliciosa variação da receita India Pale Ale. A mistura de lúpulos americanos com o toque especial da rapadura conferem a essa cerveja um delicioso equilíbrio entre o sabor do malte e as notas cítricas do maracujá. O resultado? Um amargor agradável e persistente, ideal para quem gosta de cervejas extremas.. . água, malte de cevada, rapadura, açúcar, lúpulo, fermento. . . ",Vixnu nome principiar divindade hindu nome delicioso variação receitar India Pale Ale misturar lúpulo americano tocar especial rapadura conferir cervejar delicioso equilíbrio sabor maltar noto cítrico maracujá resultar amargor agradável persistente ideal gostar cervejar extremo água maltar cevar rapadura açúcar lúpulo fermentar,
50,CORONA,"Corona Extra é a cerveja mais vendida e a marca mais exportada do México. Esta cerveja do tipo Pilsen foi produzida pela primeira vez em 1925 pela Cervecería Modelo, localizada na Cidade do México. Possui sabor leve de baixa graduação alcoólica. Uma fatia de limão no gargalo reforça a acidez com suas doses cítricas, fazendo com que a experiência de tomar a Corona se torne especial. Corona não é só uma cerveja, é um estilo de vida. Um convite para se desconectar da rotina e aproveitar mais a vida lá fora, na praia e curtindo um pôr do sol com os amigos.. O sabor marcante e amargor presente de Corona permitem que ela harmonize com bolinhos de bacalhau, ostras temperadas ou camarões fritos. Uma fatia de limão no gargalo transforma a experiência em algo ainda mais especial.. água, malte, arroz, lúpulo. cevada, glúten. 0-4 ºC. 18.0",Corona Extra cervejar vendido marcar exportar México cervejar Pilsen produzir 1925 Cervecería Modelo localizar Cidade México Possui sabor levar baixo graduação alcoólico fatiar limão gargalo reforçar acidez dose cítrico fazer experiência tomar Corona tornar especial Corona cervejar estilar vidar convite desconectar rotina aproveitar vidar praia curtir pôr sol amigo sabor marcante amargor presentar Corona permitir harmonizar bolo bacalhau ostra temperar camarão frito fatiar limão gargalo transformar experiência especial água maltar arroz lúpulo cevar glúten 0-4 ºC. 18.0,CORONA EXTRA
51,CORONACORONITA,"Em uma garrafa de 210ml, Coronita é perfeita para momentos descontraídos e tranquilos. Leve um pack para o próximo encontro entre amigos e não esqueça de levar o limão. Corona não é só uma cerveja, é um estilo de vida. Um convite para se desconectar da rotina e aproveitar mais a vida lá fora, na praia e curtindo um pôr do sol com os amigos.A Corona clássica: gelada e com uma fatia de limão.. O sabor marcante e amargor presente de Corona permitem que ela harmonize com bolinhos de bacalhau, ostras temperadas ou camarões fritos. Uma fatia de limão no gargalo transforma a experiência em algo ainda mais especial.. água, malte, arroz, lúpulo. cevada, glúten. 0-4 ºC. 18.0",garrafa 210ml Coronita perfeito momento descontrair tranquilo Leve pack encontrar amigo esquecer levar limão Corona cervejar estilar vidar convite desconectar rotina aproveitar vidar praia curtir pôr sol amigo Corona clássico gelar fatiar limão sabor marcante amargor presentar Corona permitir harmonizar bolo bacalhau ostra temperar camarão frito fatiar limão gargalo transformar experiência especial água maltar arroz lúpulo cevar glúten 0-4 ºC. 18.0,
52,FRANZISKANER DUNKEL,"Fundada em 1363 em Munique, capital do tradicional polo cervejeiro da Bavária, a marca mantém até hoje os preceitos da Lei de Pureza da Baviera de 1516. A Franziskaner Hefe Weissbier Dunkel é uma cerveja de trigo escura. Possui sabor intenso do malte torrado, uma cerveja que agrada os amantes de cervejas escuras. Espuma abundante e cremosa. Tem um teor alcoólico de 5,5% e harmoniza com bacon, carnes vermelhas e chocolates.. . água, malte de trigo, malte de cevada, lúpulo, fermento. . . ","Fundada 1363 Munique capital tradicional polo cervejeiro Bavária marcar manter hoje preceito Lei Pureza Baviera 1516 Franziskaner Hefe Weissbier Dunkel cervejar trigar escuro Possui sabor intenso maltar torrar cervejar agradar amante cervejar escuro Espuma abundante cremoso teor alcoólico 5,5 harmonizar bacon carne vermelho chocolate água maltar trigar maltar cevar lúpulo fermentar",
53,FRANZISKANER HELL,"Fundada em 1363 em Munique, capital do tradicional polo cervejeiro da Bavária, a marca mantém até hoje os preceitos da Lei de Pureza da Baviera de 1516. A Franziskaner Hefe Weissbier Hell é uma cerveja de trigo clara, turva, com aroma frutado, lembrando banana e cravo. Espuma abundante, branca e cremosa.Tem um teor alcoólico de 5% e harmoniza com saladas, peixes e frutos do mar.. . água, malte de trigo, malte de cevada, lúpulo, fermento. . . ",Fundada 1363 Munique capital tradicional polo cervejeiro Bavária marcar manter hoje preceito Lei Pureza Baviera 1516 Franziskaner Hefe Weissbier Hell cervejar trigar claro turvo aromar frutar lembrar banana cravar Espuma abundante branco cremoso teor alcoólico harmonizar salada peixe fruto mar água maltar trigar maltar cevar lúpulo fermentar,
54,FRANZISKANER KRISTALL KLAR,"A Cerveja Franziskaner Kristall Klar passa por uma filtragem especial, que elimina a base de fermento da garrafa e possui o mais alto grau de carbonatação dentre os produtos da cervejaria Franziskaner. Esse resultado, produz uma cerveja de trigo com cor cristalina de sabor leve, refrescante e aroma levemente frutado.. . água, malte de trigo, malte de cevada, lúpulo. . . ",Cerveja Franziskaner Kristall Klar passar filtragem especial eliminar base fermentar garrafa possuir alto grau carbonatação dentre produto cervejar Franziskaner resultar produzir cervejar trigar cor cristalino sabor levar refrescante aromar levemente frutar água maltar trigar maltar cevar lúpulo,
55,GOOSE ISLANDGOOSE IPA,"A Goose Island IPA é inspirada nas tradicionais India Pale Ales que eram enviadas da Inglaterra para a Índia – altamente lupulada para preservar seu sabor distinto durante a longa viagem. O resultado é o sonho de um amante de lúpulo com um aroma frutado tropical e herbal desencadeado pelo dry hop e um sabor maltado agradável com corpo médio e um amargor equilibrado.. . água, malte, lúpulo. . . ",Goose Island IPA inspirar tradicional India Pale Ales ser enviar Inglaterra Índia altamente lupulada preservar sabor distinto durante longo viagem resultar sonhar amantar lúpulo aromar frutar tropical herbal desencadear dry hop sabor maltar agradável corpo médio amargor equilibrar água maltar lúpulo,GOOSE
56,GOOSE ISLAND HONKERS ALE,"Inspirada em visitas do fundador da marca, John Hall a pubs ingleses, a Cerveja Goose Island Honkers Ale é uma autêntica English Bitter e foi a primeira cerveja produzida pela marca. Ela combina aroma de lúpulo frutado com um rico meio malte para criar uma cerveja perfeitamente equilibrada.. . água, malte de cevada, malte de trigo, lúpulo. . . ",Inspirada visitar fundador marcar John Hall pub inglesar Cerveja Goose Island Honkers Ale autêntico English Bitter cervejar produzir marcar combinar aromar lúpulo frutar rico maltar criar cervejar perfeitamente equilibrar água maltar cevar maltar trigar lúpulo,CAMDEN PALE ALE
57,GOOSE ISLAND MIDWAY,"A Goose Island Midway é uma Session IPA leve e refrescante. Ela tem sua história toda ligada à Chicago. Seu nome é originário da Feira Mundial da cidade, de 1893. Em seu centro, estava a Midway Plaisance, uma área que exibia a primeira roda gigante do mundo, reunindo visitantes de todas as nacionalidades. Nesse espírito, a cerveja é uma session pronta para reunir amantes de cerveja de todos os cantos do planeta com seu aroma tropical de lúpulo e um agradável final maltado.. . água, malte, lúpulo. . . ",Goose Island Midway Session IPA levar refrescante história ligar Chicago nome originário Feira Mundial cidade 1893 centrar Midway Plaisance exibir rodar gigante mundo reunir visitante nacionalidade espírito cervejar session pronto reunir amante cervejar canto planeta aromar tropical lúpulo agradável maltar água maltar lúpulo,
58,GOOSE ISLAND SOFIE,"A premiada Cerveja Goose Island Sofie aterrissou no Brasil. Ela é uma Belgian Farmhouse Ale que tem 20% de sua receita refermentada com raspas de laranja em barris de vinho.. . água, malte de cevada, malte de trigo, lúpulo, levedura, cascas de laranja. . . ",premiar Cerveja Goose Island Sofie aterrissou Brasil Belgian Farmhouse Ale 20 receitar refermentar raspar laranjo barrir vinho água maltar cevar maltar trigar lúpulo levedura cascar laranjo,
59,KONA BIG WAVE,. . . . . ,,
60,KONA LONG BOARD,. . . . . ,,
61,PATAGONIA AMBER LAGER,"A cor marrom acobreada e o sabor equilibrado de malte e lúpulo da Patagonia Amber Lager não deixam dúvidas: esta é uma American Amber Lager clássica! Os maltes Melanoidin, Carared e Carapils usados em sua produção lhe conferem um aroma sutil de caramelo e boa formação de espuma. Deguste esta cerveja com bacalhau, anchovas ou frutos do mar para realçar ainda mais sua refrescância.. . água, malte, cereais não malteados, lúpulo. . . ",cor marrom acobrear sabor equilibrar maltar lúpulo Patagonia Amber Lager deixar dúvida American Amber Lager clássico malte Melanoidin Carared Carapils usar produção conferir aromar sutil caramelo formação espumar Deguste cervejar bacalhau anchova fruto mar realçar refrescância água maltar cereal malteados lúpulo,
62,PATAGONIA BOHEMIAN PILSENER,"A Patagonia Bohemian Pilsener é uma tradicional cerveja do tipo Pilsen. Ela é produzida com o lúpulo tcheco Saaz que proporciona um aroma fresco e frutado bem característico, além de uma coloração dourada profunda. Escolha pratos com frutos do mar e peixes, como anchovas ou bacalhau, para combinar com o sabor dessa cerveja argentina.. Lula frita é uma ótima pedida com Pilsen, pois a cerveja vai limpar o paladar deixando o sabor da lula intacto. Todo peixe com sabor intenso vai muito bem com esse estilo de cerveja.. água, malte, lúpulo. . 0-4 ºC. 18.0",Patagonia Bohemian Pilsener tradicional cervejar Pilsen produzir lúpulo tcheco Saaz proporcionar aromar fresco frutar característico coloração dourar profundo Escolha prato fruto mar peixe anchova bacalhau combinar sabor cervejar argentino Lula frito ótima pedir Pilsen cervejar limpar paladar deixar sabor lula intacto peixe sabor intenso estilar cervejar água maltar lúpulo 0-4 ºC. 18.0,
63,PATAGONIA WEISSE,"A Patagonia Weisse tem aroma cítrico marcante e cor clara — características tradicionais das cervejas de trigo do tipo Witbier. Notas de laranja, limão e abacaxi equilibram perfeitamente esse aroma e o sabor refrescante e pouco adocicado desta cerveja. Experimente com saladas temperadas com limão, peixes e frutos do mar para harmonizar com este clássico rótulo argentino.. O sabor e os aromas marcantes da Patagonia Weisse combinam muito bem com vários pratos com peixe.. água, maltes de cevada, trigo, cereais não malteados, lúpulo, extratos naturais de laranja, semente de coentro. . 4-8 ºC. 10.0",Patagonia Weisse aromar cítrico marcante cor claro característico tradicional cervejar trigar Witbier Notas laranjo limão abacaxi equilibrar perfeitamente aromar sabor refrescante adocicar cervejar Experimente salada temperar limão peixe fruto mar harmonizar clássico rótulo argentino sabor aromar marcante Patagonia Weisse combinar prato peixe água malte cevar trigar cereal malteados lúpulo extratos natural laranjo sementar coentro 4-8 ºC. 10.0,
